### ISSUE TITLE
!!! FAILED BINDER TRANSACTION !!!

### ISSUE THREAD

**Issue by TheProdigyLeague** [googlesamples/android-architecture#1045]
# What happened?

Trying to emulate an Android Device on Android Studio:

```rb
Android Studio Narwhal Feature Drop | 2025.1.2 Patch 1
Build #AI-251.26094.121.2512.13930704, built on August 13, 2025
Runtime version: 21.0.6+-13391695-b895.109 amd64
VM: OpenJDK 64-Bit Server VM by JetBrains s.r.o.
Toolkit: sun.awt.X11.XToolkit
Linux 6.6.76-08096-g300882a0a131
Debian GNU/Linux 12 (bookworm); glibc: 2.36
Kotlin plugin: K2 mode
GC: G1 Young Generation, G1 Concurrent GC, G1 Old Generation
Memory: 2048M
Cores: 8
Registry:
  ide.experimental.ui=true
Non-Bundled Plugins:
  PythonCore (251.26094.121)
Current Desktop: X-Generic
```

**OS Version**

```rb
Intel Alder Lake Chromebook (omnigul, version 138.16295.0)
Linux penguin 6.6.76-08096-g300882a0a131 #1 SMP PREEMPT_DYNAMIC Sat, 24 May 2025 01:23:41 -0700 x86_64 GNU/Linux
```
Produces CPU overload and high network overhaul:

# usr/bin/wireshark.sh
```rb
nl80211 not found.
 ** (wireshark:16052) 18:16:38.707780 [GUI WARNING] -- Ignoring unexpected wl_surface.enter received for output with id: 7 screen name: "Screen5" screen model: "unknown" This is most likely a bug in the compositor.
 ** (androiddump:16101) 18:16:40.447073 [androiddump WARNING] ./extcap/androiddump.c:1209 -- register_interfaces(): Error while getting Bluetooth application process id by <shell:ps -A | grep com.android.bluetooth> (0x561c499ce304 len=0)
 ** (wireshark:16052) 18:16:59.028834 [Capture MESSAGE] -- Capture Start ...
 ** (wireshark:16052) 18:16:59.400351 [Capture MESSAGE] -- Capture started
 ** (wireshark:16052) 18:16:59.400439 [Capture MESSAGE] -- File: "/tmp/wireshark_eth0UQWVB3.pcapng"
 ** (wireshark:16052) 18:18:30.574327 [Capture MESSAGE] -- Capture Stop ...
 ** (wireshark:16052) 18:18:30.602476 [Capture MESSAGE] -- Capture stopped.
 ** (wireshark:16052) 18:21:27.098177 [GUI WARNING] -- Ignoring unexpected wl_surface.enter received for output with id: 7 screen name: "Screen5" screen model: "unknown" This is most likely a bug in the compositor.
 ** (wireshark:16052) 18:22:00.631048 [GUI WARNING] -- Ignoring unexpected wl_surface.enter received for output with id: 7 screen name: "Screen5" screen model: "unknown" This is most likely a bug in the compositor.

33	0.743381036	100.115.92.202	172.217.165.202	QUIC	81	Handshake, DCID=efc7a819aa907642
34	0.748619384	100.115.92.202	172.217.165.202	QUIC	79	Handshake, DCID=efc7a819aa907642
35	0.760813078	172.217.165.202	100.115.92.202	QUIC	1292	Handshake, SCID=efc7a819aa907642
36	0.761092531	172.217.165.202	100.115.92.202	QUIC	232	Protected Payload (KP0)
37	0.764256158	172.217.165.202	100.115.92.202	QUIC	1292	Handshake, SCID=efc7a819aa907642
38	0.764439901	172.217.165.202	100.115.92.202	QUIC	155	Protected Payload (KP0)
39	0.786814733	100.115.92.202	224.0.0.251	MDNS	117	Standard query 0x0089 ANY Android.local, "QM" question A, cache flush 10.0.2.15 AAAA, cache flush fec0::5054:ff:fe12:3456
40	0.851055686	100.115.92.202	224.0.0.251	MDNS	96	Standard query 0x008a ANY adb-EMULATOR36X1X9X0._adb._tcp.local, "QM" question
41	0.916399607	2601:587:4300:f7b0:216:3eff:fe3d:2611	2607:f8b0:4008:801::200a	TCP	94	38826 → 443 [SYN] Seq=0 Win=64800 Len=0 MSS=1440 SACK_PERM TSval=3668623080 TSecr=0 WS=128
42	0.935520611	2607:f8b0:4008:801::200a	2601:587:4300:f7b0:216:3eff:fe3d:2611	TCP	94	443 → 38826 [SYN, ACK] Seq=0 Ack=1 Win=65535 Len=0 MSS=1440 SACK_PERM TSval=637387725 TSecr=3668623080 WS=256
43	0.935570277	2601:587:4300:f7b0:216:3eff:fe3d:2611	2607:f8b0:4008:801::200a	TCP	86	38826 → 443 [ACK] Seq=1 Ack=1 Win=64896 Len=0 TSval=3668623099 TSecr=637387725
44	1.003383154	100.115.92.202	100.115.92.193	DNS	97	Standard query 0xb1cd AAAA mobileconfiguration-pa.googleapis.com
45	1.003548201	100.115.92.202	100.115.92.193	DNS	97	Standard query 0x5ab3 A mobileconfiguration-pa.googleapis.com
46	1.018441832	100.115.92.193	100.115.92.202	DNS	209	Standard query response 0xb1cd AAAA mobileconfiguration-pa.googleapis.com AAAA 2607:f8b0:4008:80d::200a AAAA 2607:f8b0:4008:801::200a AAAA 2607:f8b0:4008:809::200a AAAA 2607:f8b0:4008:814::200a
47	1.020186837	100.115.92.193	100.115.92.202	DNS	305	Standard query response 0x5ab3 A mobileconfiguration-pa.googleapis.com A 172.217.15.202 A 142.250.64.138 A 142.250.64.170 A 142.250.189.138 A 172.217.165.202 A 192.178.50.74 A 192.178.50.42 A 172.217.3.74 A 142.250.64.202 A 142.250.217.170 A 142.250.217.202 A 142.250.217.234 A 172.217.2.202
48	1.040166173	fe80::216:3eff:fedd:1c8c	ff02::1:ff74:baa0	ICMPv6	86	Neighbor Solicitation for fe80::7054:abff:fe74:baa0 from 00:16:3e:dd:1c:8c
49	1.057679899	100.115.92.202	172.217.165.202	QUIC	81	Handshake, DCID=efc7a819aa907642
50	1.176623564	2601:587:4300:f7b0:216:3eff:fe3d:2611	2607:f8b0:4008:80d::200a	TCP	94	54714 → 443 [SYN] Seq=0 Win=64800 Len=0 MSS=1440 SACK_PERM TSval=829823331 TSecr=0 WS=128
51	1.183966803	2601:587:4300:f7b0:216:3eff:fe3d:2611	2607:f8b0:4008:801::200a	TLSv1.3	688	Client Hello
52	1.184079341	100.115.92.202	172.217.165.202	QUIC	83	Handshake, DCID=efc7a819aa907642
53	1.184109090	100.115.92.202	172.217.165.202	QUIC	83	Handshake, DCID=efc7a819aa907642
54	1.200624933	2607:f8b0:4008:801::200a	2601:587:4300:f7b0:216:3eff:fe3d:2611	TCP	86	443 → 38826 [ACK] Seq=1 Ack=603 Win=269312 Len=0 TSval=637387990 TSecr=3668623347
55	1.208265001	2607:f8b0:4008:80d::200a	2601:587:4300:f7b0:216:3eff:fe3d:2611	TCP	94	443 → 54714 [SYN, ACK] Seq=0 Ack=1 Win=65535 Len=0 MSS=1440 SACK_PERM TSval=3310214075 TSecr=829823331 WS=256
56	1.208297584	2601:587:4300:f7b0:216:3eff:fe3d:2611	2607:f8b0:4008:80d::200a	TCP	86	54714 → 443 [ACK] Seq=1 Ack=1 Win=64896 Len=0 TSval=829823363 TSecr=3310214075
57	1.213378454	2607:f8b0:4008:801::200a	2601:587:4300:f7b0:216:3eff:fe3d:2611	TLSv1.3	1294	Server Hello, Change Cipher Spec
58	1.213411875	2601:587:4300:f7b0:216:3eff:fe3d:2611	2607:f8b0:4008:801::200a	TCP	86	38826 → 443 [ACK] Seq=603 Ack=1209 Win=63744 Len=0 TSval=3668623377 TSecr=637388002
59	1.214743466	2607:f8b0:4008:801::200a	2601:587:4300:f7b0:216:3eff:fe3d:2611	TCP	1294	443 → 38826 [PSH, ACK] Seq=1209 Ack=603 Win=269312 Len=1208 TSval=637388002 TSecr=3668623347 [TCP segment of a reassembled PDU]
60	1.214776311	2601:587:4300:f7b0:216:3eff:fe3d:2611	2607:f8b0:4008:801::200a	TCP	86	38826 → 443 [ACK] Seq=603 Ack=2417 Win=62592 Len=0 TSval=3668623378 TSecr=637388002
61	1.214749730	2607:f8b0:4008:801::200a	2601:587:4300:f7b0:216:3eff:fe3d:2611	TLSv1.3	2329	Application Data
62	1.214786859	2601:587:4300:f7b0:216:3eff:fe3d:2611	2607:f8b0:4008:801::200a	TCP	86	38826 → 443 [ACK] Seq=603 Ack=4660 Win=60416 Len=0 TSval=3668623378 TSecr=637388002
63	1.226998016	2601:587:4300:f7b0:216:3eff:fe3d:2611	2607:f8b0:4008:80d::200a	TLSv1.3	675	Client Hello
64	1.250324589	2607:f8b0:4008:80d::200a	2601:587:4300:f7b0:216:3eff:fe3d:2611	TCP	86	443 → 54714 [ACK] Seq=1 Ack=590 Win=269312 Len=0 TSval=3310214119 TSecr=829823381
65	1.261252242	2607:f8b0:4008:80d::200a	2601:587:4300:f7b0:216:3eff:fe3d:2611	TLSv1.3	1294	Server Hello, Change Cipher Spec
66	1.261296526	2601:587:4300:f7b0:216:3eff:fe3d:2611	2607:f8b0:4008:80d::200a	TCP	86	54714 → 443 [ACK] Seq=590 Ack=1209 Win=63744 Len=0 TSval=829823416 TSecr=3310214132
67	1.262165639	2607:f8b0:4008:80d::200a	2601:587:4300:f7b0:216:3eff:fe3d:2611	TCP	1294	443 → 54714 [PSH, ACK] Seq=1209 Ack=590 Win=269312 Len=1208 TSval=3310214132 TSecr=829823381 [TCP segment of a reassembled PDU]
68	1.262190704	2601:587:4300:f7b0:216:3eff:fe3d:2611	2607:f8b0:4008:80d::200a	TCP	86	54714 → 443 [ACK] Seq=590 Ack=2417 Win=62592 Len=0 TSval=829823417 TSecr=3310214132
69	1.262836881	2607:f8b0:4008:80d::200a	2601:587:4300:f7b0:216:3eff:fe3d:2611	TCP	1294	443 → 54714 [ACK] Seq=2417 Ack=590 Win=269312 Len=1208 TSval=3310214132 TSecr=829823381 [TCP segment of a reassembled PDU]
70	1.262892921	2601:587:4300:f7b0:216:3eff:fe3d:2611	2607:f8b0:4008:80d::200a	TCP	86	54714 → 443 [ACK] Seq=590 Ack=3625 Win=61440 Len=0 TSval=829823417 TSecr=3310214132
71	1.263608693	2607:f8b0:4008:80d::200a	2601:587:4300:f7b0:216:3eff:fe3d:2611	TLSv1.3	1140	Application Data
72	1.263642588	2601:587:4300:f7b0:216:3eff:fe3d:2611	2607:f8b0:4008:80d::200a	TCP	86	54714 → 443 [ACK] Seq=590 Ack=4679 Win=60416 Len=0 TSval=829823418 TSecr=3310214132
73	1.424175126	fe80::216:3eff:fedd:1c8c	ff02::1:ffb2:7764	ICMPv6	86	Neighbor Solicitation for fe80::fad2:acff:feb2:7764 from 00:16:3e:dd:1c:8c
74	1.447444530	fe80::7054:abff:fe74:baa0	ff02::1:ffb2:7764	ICMPv6	86	Neighbor Solicitation for fe80::fad2:acff:feb2:7764 from 00:16:3e:dd:1c:8c
75	1.569499533	100.115.92.202	172.217.165.202	QUIC	125	Handshake, DCID=efc7a819aa907642
76	1.575364743	100.115.92.202	172.217.165.202	QUIC	113	Protected Payload (KP0), DCID=efc7a819aa907642
77	1.588606865	172.217.165.202	100.115.92.202	QUIC	990	Protected Payload (KP0)
78	1.588608731	172.217.165.202	100.115.92.202	QUIC	164	Protected Payload (KP0)
79	1.619659072	172.217.165.202	100.115.92.202	QUIC	66	Protected Payload (KP0)
80	1.668075082	2601:587:4300:f7b0:216:3eff:fe3d:2611	2607:f8b0:4008:80d::200a	TLSv1.3	160	Change Cipher Spec, Application Data
81	1.668730720	2601:587:4300:f7b0:216:3eff:fe3d:2611	2607:f8b0:4008:80d::200a	TLSv1.3	178	Application Data
82	1.684614089	2607:f8b0:4008:80d::200a	2601:587:4300:f7b0:216:3eff:fe3d:2611	TLSv1.3	1088	Application Data, Application Data
83	1.684657343	2601:587:4300:f7b0:216:3eff:fe3d:2611	2607:f8b0:4008:80d::200a	TCP	86	54714 → 443 [ACK] Seq=756 Ack=5681 Win=59520 Len=0 TSval=829823839 TSecr=3310214556
84	1.684840422	2607:f8b0:4008:80d::200a	2601:587:4300:f7b0:216:3eff:fe3d:2611	TLSv1.3	117	Application Data
85	1.684863206	2601:587:4300:f7b0:216:3eff:fe3d:2611	2607:f8b0:4008:80d::200a	TCP	86	54714 → 443 [ACK] Seq=756 Ack=5712 Win=59520 Len=0 TSval=829823839 TSecr=3310214556
86	1.879465907	2601:587:4300:f7b0:216:3eff:fe3d:2611	2607:f8b0:4008:801::200a	TLSv1.3	160	Change Cipher Spec, Application Data
87	1.880013465	100.115.92.202	172.217.165.202	QUIC	75	Protected Payload (KP0), DCID=efc7a819aa907642
88	1.885633722	100.115.92.202	172.217.165.202	QUIC	75	Protected Payload (KP0), DCID=efc7a819aa907642
89	1.898673937	2607:f8b0:4008:801::200a	2601:587:4300:f7b0:216:3eff:fe3d:2611	TLSv1.3	1050	Application Data, Application Data
90	1.898712535	2601:587:4300:f7b0:216:3eff:fe3d:2611	2607:f8b0:4008:801::200a	TCP	86	38826 → 443 [ACK] Seq=677 Ack=5624 Win=59520 Len=0 TSval=3668624062 TSecr=637388686
91	1.966482090	100.115.92.202	172.217.165.202	QUIC	244	Protected Payload (KP0), DCID=efc7a819aa907642
92	1.999238544	100.115.92.202	172.217.165.202	QUIC	860	Protected Payload (KP0), DCID=efc7a819aa907642
93	2.003223167	2601:587:4300:f7b0:216:3eff:fe3d:2611	2607:f8b0:4008:80d::200a	TLSv1.3	418	Application Data
94	2.008843573	2601:587:4300:f7b0:216:3eff:fe3d:2611	2607:f8b0:4008:80d::200a	TLSv1.3	117	Application Data
95	2.008939175	2601:587:4300:f7b0:216:3eff:fe3d:2611	2607:f8b0:4008:80d::200a	TLSv1.3	484	Application Data
96	2.010370331	172.217.165.202	100.115.92.202	QUIC	70	Protected Payload (KP0)
97	2.010712949	2601:587:4300:f7b0:216:3eff:fe3d:2611	2607:f8b0:4008:80d::200a	TLSv1.3	117	Application Data
98	2.024562997	2607:f8b0:4008:80d::200a	2601:587:4300:f7b0:216:3eff:fe3d:2611	TCP	86	443 → 54714 [ACK] Seq=5712 Ack=1119 Win=269056 Len=0 TSval=3310214895 TSecr=829824158
99	2.027245446	2607:f8b0:4008:80d::200a	2601:587:4300:f7b0:216:3eff:fe3d:2611	TCP	86	443 → 54714 [ACK] Seq=5712 Ack=1548 Win=268800 Len=0 TSval=3310214898 TSecr=829824163
100	2.041643010	172.217.165.202	100.115.92.202	QUIC	66	Protected Payload (KP0)
101	2.046607556	2607:f8b0:4008:80d::200a	2601:587:4300:f7b0:216:3eff:fe3d:2611	TLSv1.3	246	Application Data
102	2.046642976	2601:587:4300:f7b0:216:3eff:fe3d:2611	2607:f8b0:4008:80d::200a	TCP	86	54714 → 443 [ACK] Seq=1548 Ack=5872 Win=59392 Len=0 TSval=829824201 TSecr=3310214918
103	2.047565230	2607:f8b0:4008:80d::200a	2601:587:4300:f7b0:216:3eff:fe3d:2611	TLSv1.3	1294	Application Data
104	2.047585978	2601:587:4300:f7b0:216:3eff:fe3d:2611	2607:f8b0:4008:80d::200a	TCP	86	54714 → 443 [ACK] Seq=1548 Ack=7080 Win=58240 Len=0 TSval=829824202 TSecr=3310214918
105	2.047566145	2607:f8b0:4008:80d::200a	2601:587:4300:f7b0:216:3eff:fe3d:2611	TLSv1.3	1294	Application Data
106	2.047589232	2601:587:4300:f7b0:216:3eff:fe3d:2611	2607:f8b0:4008:80d::200a	TCP	86	54714 → 443 [ACK] Seq=1548 Ack=8288 Win=57088 Len=0 TSval=829824202 TSecr=3310214918
107	2.047566505	2607:f8b0:4008:80d::200a	2601:587:4300:f7b0:216:3eff:fe3d:2611	TLSv1.3	1294	Application Data
108	2.047590874	2601:587:4300:f7b0:216:3eff:fe3d:2611	2607:f8b0:4008:80d::200a	TCP	86	54714 → 443 [ACK] Seq=1548 Ack=9496 Win=55936 Len=0 TSval=829824202 TSecr=3310214918
109	2.048319579	2607:f8b0:4008:80d::200a	2601:587:4300:f7b0:216:3eff:fe3d:2611	TLSv1.3	1104	Application Data
110	2.048329496	2601:587:4300:f7b0:216:3eff:fe3d:2611	2607:f8b0:4008:80d::200a	TCP	86	54714 → 443 [ACK] Seq=1548 Ack=10514 Win=55040 Len=0 TSval=829824203 TSecr=3310214918
111	2.048320180	2607:f8b0:4008:80d::200a	2601:587:4300:f7b0:216:3eff:fe3d:2611	TLSv1.3	226	Application Data
112	2.048334012	2601:587:4300:f7b0:216:3eff:fe3d:2611	2607:f8b0:4008:80d::200a	TCP	86	54714 → 443 [ACK] Seq=1548 Ack=10654 Win=54912 Len=0 TSval=829824203 TSecr=3310214919
113	2.064215748	fe80::216:3eff:fedd:1c8c	ff02::1:ff74:baa0	ICMPv6	86	Neighbor Solicitation for fe80::7054:abff:fe74:baa0 from 00:16:3e:dd:1c:8c
114	2.073537171	172.217.165.202	100.115.92.202	QUIC	1288	Protected Payload (KP0)
115	2.076332742	172.217.165.202	100.115.92.202	QUIC	1292	Protected Payload (KP0)
116	2.076334053	172.217.165.202	100.115.92.202	QUIC	1292	Protected Payload (KP0)
117	2.076334646	172.217.165.202	100.115.92.202	QUIC	1292	Protected Payload (KP0)
118	2.076335167	172.217.165.202	100.115.92.202	QUIC	1292	Protected Payload (KP0)
119	2.076335678	172.217.165.202	100.115.92.202	QUIC	1292	Protected Payload (KP0)
120	2.076336194	172.217.165.202	100.115.92.202	QUIC	1292	Protected Payload (KP0)
121	2.076336700	172.217.165.202	100.115.92.202	QUIC	1292	Protected Payload (KP0)
122	2.076337197	172.217.165.202	100.115.92.202	QUIC	1292	Protected Payload (KP0)
123	2.076354105	172.217.165.202	100.115.92.202	QUIC	1292	Protected Payload (KP0)
124	2.083775733	172.217.165.202	100.115.92.202	QUIC	1292	Protected Payload (KP0)
125	2.091707603	172.217.165.202	100.115.92.202	QUIC	1292	Protected Payload (KP0)
126	2.102341281	172.217.165.202	100.115.92.202	QUIC	1292	Protected Payload (KP0)
127	2.112004734	172.217.165.202	100.115.92.202	QUIC	1292	Protected Payload (KP0)
128	2.119533787	2601:587:4300:f7b0:216:3eff:fe3d:2611	2607:f8b0:4008:80d::200a	TLSv1.3	125	Application Data
129	2.120741458	100.115.92.202	224.0.0.251	MDNS	541	Standard query response 0x0000 TXT, cache flush PTR _adb._tcp.local PTR adb-EMULATOR36X1X9X0._adb._tcp.local SRV, cache flush 0 0 5555 Android.local PTR, cache flush Android.local PTR, cache flush Android.local PTR, cache flush Android.local A, cache flush 10.0.2.15 AAAA, cache flush fe80::5054:ff:fe12:3456 AAAA, cache flush fec0::5054:ff:fe12:3456 NSEC, cache flush adb-EMULATOR36X1X9X0._adb._tcp.local NSEC, cache flush 15.2.0.10.in-addr.arpa NSEC, cache flush 6.5.4.3.2.1.E.F.F.F.0.0.4.5.0.5.0.0.0.0.0.0.0.0.0.0.0.0.0.8.E.F.ip6.arpa NSEC, cache flush 6.5.4.3.2.1.E.F.F.F.0.0.4.5.0.5.0.0.0.0.0.0.0.0.0.0.0.0.0.C.E.F.ip6.arpa NSEC, cache flush Android.local
130	2.120824328	fe80::216:3eff:fe3d:2611	ff02::fb	MDNS	561	Standard query response 0x0000 TXT, cache flush PTR _adb._tcp.local PTR adb-EMULATOR36X1X9X0._adb._tcp.local SRV, cache flush 0 0 5555 Android.local PTR, cache flush Android.local PTR, cache flush Android.local PTR, cache flush Android.local A, cache flush 10.0.2.15 AAAA, cache flush fe80::5054:ff:fe12:3456 AAAA, cache flush fec0::5054:ff:fe12:3456 NSEC, cache flush adb-EMULATOR36X1X9X0._adb._tcp.local NSEC, cache flush 15.2.0.10.in-addr.arpa NSEC, cache flush 6.5.4.3.2.1.E.F.F.F.0.0.4.5.0.5.0.0.0.0.0.0.0.0.0.0.0.0.0.8.E.F.ip6.arpa NSEC, cache flush 6.5.4.3.2.1.E.F.F.F.0.0.4.5.0.5.0.0.0.0.0.0.0.0.0.0.0.0.0.C.E.F.ip6.arpa NSEC, cache flush Android.local
131	2.120914510	100.115.92.202	224.0.0.251	MDNS	633	Standard query response 0x0000 TXT, cache flush PTR _adb._tcp.local PTR adb-EMULATOR36X1X9X0._adb._tcp.local SRV, cache flush 0 0 5555 Android.local PTR, cache flush Android.local PTR, cache flush Android.local PTR, cache flush Android.local PTR, cache flush Android.local A, cache flush 10.0.2.16 AAAA, cache flush fec0::804a:5b46:fd73:56ab AAAA, cache flush fe80::e1c7:9bd9:610b:e3c0 AAAA, cache flush fec0::f89d:3813:d3c3:2e35 NSEC, cache flush adb-EMULATOR36X1X9X0._adb._tcp.local NSEC, cache flush 16.2.0.10.in-addr.arpa NSEC, cache flush B.A.6.5.3.7.D.F.6.4.B.5.A.4.0.8.0.0.0.0.0.0.0.0.0.0.0.0.0.C.E.F.ip6.arpa NSEC, cache flush 0.C.3.E.B.0.1.6.9.D.B.9.7.C.1.E.0.0.0.0.0.0.0.0.0.0.0.0.0.8.E.F.ip6.arpa NSEC, cache flush 5.3.E.2.3.C.3.D.3.1.8.3.D.9.8.F.0.0.0.0.0.0.0.0.0.0.0.0.0.C.E.F.ip6.arpa NSEC, cache flush Android.local
132	2.120932711	fe80::216:3eff:fe3d:2611	ff02::fb	MDNS	653	Standard query response 0x0000 TXT, cache flush PTR _adb._tcp.local PTR adb-EMULATOR36X1X9X0._adb._tcp.local SRV, cache flush 0 0 5555 Android.local PTR, cache flush Android.local PTR, cache flush Android.local PTR, cache flush Android.local PTR, cache flush Android.local A, cache flush 10.0.2.16 AAAA, cache flush fec0::804a:5b46:fd73:56ab AAAA, cache flush fe80::e1c7:9bd9:610b:e3c0 AAAA, cache flush fec0::f89d:3813:d3c3:2e35 NSEC, cache flush adb-EMULATOR36X1X9X0._adb._tcp.local NSEC, cache flush 16.2.0.10.in-addr.arpa NSEC, cache flush B.A.6.5.3.7.D.F.6.4.B.5.A.4.0.8.0.0.0.0.0.0.0.0.0.0.0.0.0.C.E.F.ip6.arpa NSEC, cache flush 0.C.3.E.B.0.1.6.9.D.B.9.7.C.1.E.0.0.0.0.0.0.0.0.0.0.0.0.0.8.E.F.ip6.arpa NSEC, cache flush 5.3.E.2.3.C.3.D.3.1.8.3.D.9.8.F.0.0.0.0.0.0.0.0.0.0.0.0.0.C.E.F.ip6.arpa NSEC, cache flush Android.local
133	2.121937188	172.217.165.202	100.115.92.202	QUIC	1292	Protected Payload (KP0)
134	2.127661470	172.217.165.202	100.115.92.202	QUIC	1292	Protected Payload (KP0)
135	2.135445073	172.217.165.202	100.115.92.202	QUIC	1292	Protected Payload (KP0)
136	2.140964850	2607:f8b0:4008:80d::200a	2601:587:4300:f7b0:216:3eff:fe3d:2611	TCP	86	443 → 54714 [ACK] Seq=10654 Ack=1587 Win=268800 Len=0 TSval=3310215012 TSecr=829824274
137	2.144971303	172.217.165.202	100.115.92.202	QUIC	1292	Protected Payload (KP0)
```
# usr/bin/androidstudio.sh
```rb
2025-08-24 18:18:58.186 32602-4801  DCU_ContactsLogService  com.google.android.gms               E  Failed to mark incremental upload successful [CONTEXT service_id=135 ]
                                                                                                    java.util.concurrent.ExecutionException: fiui: sync policy is not enabled
                                                                                                    	at gjrh.j(:com.google.android.gms@253133032@25.31.33 (190800-795226510):21)
                                                                                                    	at gjrq.u(:com.google.android.gms@253133032@25.31.33 (190800-795226510):71)
                                                                                                    	at com.google.android.gms.romanesco.service.ContactsLoggerUploadService.a(:com.google.android.gms@253133032@25.31.33 (190800-795226510):237)
                                                                                                    	at ckjl.call(:com.google.android.gms@253133032@25.31.33 (190800-795226510):30)
                                                                                                    	at java.util.concurrent.FutureTask.run(FutureTask.java:264)
                                                                                                    	at bash.c(:com.google.android.gms@253133032@25.31.33 (190800-795226510):50)
                                                                                                    	at bash.run(:com.google.android.gms@253133032@25.31.33 (190800-795226510):70)
                                                                                                    	at java.util.concurrent.ThreadPoolExecutor.runWorker(ThreadPoolExecutor.java:1137)
                                                                                                    	at java.util.concurrent.ThreadPoolExecutor$Worker.run(ThreadPoolExecutor.java:637)
                                                                                                    	at baya.run(:com.google.android.gms@253133032@25.31.33 (190800-795226510):8)
                                                                                                    	at java.lang.Thread.run(Thread.java:1012)
                                                                                                    Caused by: fiui: sync policy is not enabled
                                                                                                    	at firq.a(:com.google.android.gms@253133032@25.31.33 (190800-795226510):167)
                                                                                                    	at gblt.a(:com.google.android.gms@253133032@25.31.33 (190800-795226510):13)
                                                                                                    	at gjrs.d(:com.google.android.gms@253133032@25.31.33 (190800-795226510):3)
                                                                                                    	at gjru.run(:com.google.android.gms@253133032@25.31.33 (190800-795226510):38)
                                                                                                    	at gjtg.execute(:com.google.android.gms@253133032@25.31.33 (190800-795226510):1)
                                                                                                    	at gjrh.f(:com.google.android.gms@253133032@25.31.33 (190800-795226510):1)
                                                                                                    	at gjrh.m(:com.google.android.gms@253133032@25.31.33 (190800-795226510):99)
                                                                                                    	at gjrh.q(:com.google.android.gms@253133032@25.31.33 (190800-795226510):13)
                                                                                                    	at gjrt.e(:com.google.android.gms@253133032@25.31.33 (190800-795226510):1)
                                                                                                    	at gjru.run(:com.google.android.gms@253133032@25.31.33 (190800-795226510):44)
                                                                                                    	at gjtg.execute(:com.google.android.gms@253133032@25.31.33 (190800-795226510):1)
                                                                                                    	at gjrh.f(:com.google.android.gms@253133032@25.31.33 (190800-795226510):1)
                                                                                                    	at gjrh.m(:com.google.android.gms@253133032@25.31.33 (190800-795226510):99)
                                                                                                    	at gjrh.q(:com.google.android.gms@253133032@25.31.33 (190800-795226510):13)
                                                                                                    	at gjqz.run(:com.google.android.gms@253133032@25.31.33 (190800-795226510):120)
                                                                                                    	at gjtg.execute(:com.google.android.gms@253133032@25.31.33 (190800-795226510):1)
                                                                                                    	at gjrh.f(:com.google.android.gms@253133032@25.31.33 (190800-795226510):1)
                                                                                                    	at gjrh.m(:com.google.android.gms@253133032@25.31.33 (190800-795226510):99)
                                                                                                    	at gjrh.q(:com.google.android.gms@253133032@25.31.33 (190800-795226510):13)
                                                                                                    	at gjrt.e(:com.google.android.gms@253133032@25.31.33 (190800-795226510):1)
                                                                                                    	at gjru.run(:com.google.android.gms@253133032@25.31.33 (190800-795226510):44)
                                                                                                    	at gjtg.execute(:com.google.android.gms@253133032@25.31.33 (190800-795226510):1)
                                                                                                    	at gjrh.f(:com.google.android.gms@253133032@25.31.33 (190800-795226510):1)
                                                                                                    	at gjrh.m(:com.google.android.gms@253133032@25.31.33 (190800-795226510):99)
                                                                                                    	at gjrh.q(:com.google.android.gms@253133032@25.31.33 (190800-795226510):13)
                                                                                                    	at gjrt.e(:com.google.android.gms@253133032@25.31.33 (190800-795226510):1)
                                                                                                    	at gjru.run(:com.google.android.gms@253133032@25.31.33 (190800-795226510):44)
                                                                                                    	at gjtg.execute(:com.google.android.gms@253133032@25.31.33 (190800-795226510):1)
                                                                                                    	at gjrh.f(:com.google.android.gms@253133032@25.31.33 (190800-795226510):1)
                                                                                                    	at gjrh.m(:com.google.android.gms@253133032@25.31.33 (190800-795226510):99)
                                                                                                    	at gjrh.t(:com.google.android.gms@253133032@25.31.33 (190800-795226510):26)
                                                                                                    	at gjud.run(:com.google.android.gms@253133032@25.31.33 (190800-795226510):5)
                                                                                                    	at gjtg.execute(:com.google.android.gms@253133032@25.31.33 (190800-795226510):1)
                                                                                                    	at gjrh.f(:com.google.android.gms@253133032@25.31.33 (190800-795226510):1)
                                                                                                    	at gjrh.m(:com.google.android.gms@253133032@25.31.33 (190800-795226510):99)
                                                                                                    	at gjrh.t(:com.google.android.gms@253133032@25.31.33 (190800-795226510):26)
                                                                                                    	at gjud.run(:com.google.android.gms@253133032@25.31.33 (190800-795226510):5)
2025-08-24 18:18:58.187 32602-4801  DCU_ContactsLogService  com.google.android.gms               E  	at gjtg.execute(:com.google.android.gms@253133032@25.31.33 (190800-795226510):1)
                                                                                                    	at gjrh.f(:com.google.android.gms@253133032@25.31.33 (190800-795226510):1)
                                                                                                    	at gjrh.m(:com.google.android.gms@253133032@25.31.33 (190800-795226510):99)
                                                                                                    	at gjrh.t(:com.google.android.gms@253133032@25.31.33 (190800-795226510):26)
                                                                                                    	at gjvr.e(:com.google.android.gms@253133032@25.31.33 (190800-795226510):5)
                                                                                                    	at gjus.run(:com.google.android.gms@253133032@25.31.33 (190800-795226510):73)
                                                                                                    	at gjvt.run(:com.google.android.gms@253133032@25.31.33 (190800-795226510):5)
                                                                                                    	at gjtp.run(:com.google.android.gms@253133032@25.31.33 (190800-795226510):20)
                                                                                                    	... 6 more
2025-08-24 18:18:58.188   649-4908  NetworkScheduler.Stats  com.google.android.gms.persistent    I  (REDACTED) Task %s/%s finished executing. cause:%s result: %s elapsed_millis: %s uptime_millis: %s exec_start_elapsed_seconds: %s
2025-08-24 18:18:58.578  1040-1040  TextToSpeech            org.chromium.arc.intent_helper       W  stop failed: not bound to TTS engine
2025-08-24 18:18:58.604   751-807   ArcWindowController     com.android.systemui                 I  No task got activated, but the Android is sleeping. Skipping to activate placeholder
2025-08-24 18:18:59.724   649-649   ThreadPoolForeg         com.google.android.gms.persistent    W  type=1400 audit(0.0:16499): avc: denied { write } for name="traced_producer" dev="tmpfs" ino=474 scontext=u:r:gmscore_app:s0:c512,c768 tcontext=u:object_r:traced_producer_socket:s0 tclass=sock_file permissive=0 app=com.google.android.gms
2025-08-24 18:19:02.049   649-1230  NullBinder              com.google.android.gms.persistent    I  NullBinder for com.google.android.gms.lockbox.service.START triggering remote TransactionTooLargeException due to Service without Chimera impl, calling uid: 10000, calling pid: 32602
2025-08-24 18:19:02.049   649-1230  .gms.persistent         com.google.android.gms.persistent    W  Large reply transaction of 1056768 bytes, interface descriptor , code 46
2025-08-24 18:19:02.055 32602-32625 JavaBinder              com.google.android.gms               E  !!! FAILED BINDER TRANSACTION !!!  (parcel size = 408)
```
